,question,answer
115,How do you approach learning new skills or technologies?," I approach learning new skills by starting with the fundamentals, practicing regularly, and working on hands-on projects to apply what I've learned."
116,How do you approach staying organized and keeping track of your progress when working on personal projects or learning new skills?," Staying organized and tracking progress is essential for personal projects and learning new skills. I utilize tools like to-do lists, project management software, and progress trackers to break down tasks into manageable steps and monitor my progress. Setting specific goals and deadlines helps maintain focus and accountability."
117,Can you share a situation where you had to collaborate with a diverse team to achieve a common goal?," Certainly! In a previous project, I collaborated with team members from diverse backgrounds and expertise to develop a web application. Each team member brought unique perspectives and skills to the table, and effective communication and collaboration were essential to align goals, delegate tasks, and integrate individual contributions into a cohesive product."
118,What steps do you take to ensure the security and integrity of your projects and data when working on development or analysis tasks?," Ensuring the security and integrity of projects and data is paramount. I implement security best practices such as using secure authentication methods, encrypting sensitive data, and regularly updating software and dependencies to patch vulnerabilities. Additionally, I adhere to data privacy regulations and conduct thorough testing and validation to detect and address potential security risks."
119,How do you approach self-directed learning and staying motivated when studying complex topics or tackling challenging problems?," Self-directed learning requires discipline and motivation. I break down complex topics into smaller, more manageable concepts and set achievable learning goals. Regularly reviewing progress and celebrating small victories helps maintain motivation. Additionally, I seek out resources like online courses, textbooks, and tutorials, and actively engage with communities and forums for support and guidance."
120,Can you share a time when you had to present technical information or findings to a non-technical audience? How did you ensure clarity and understanding?," Certainly! In a previous role, I had to present the findings of a machine learning project to company stakeholders who had limited technical knowledge. I prepared a concise and visually engaging presentation, avoiding jargon and using relatable examples to illustrate complex concepts. I encouraged questions and fostered an open dialogue to ensure clarity and understanding among the audience."
121,What role do you believe continuous feedback and reflection play in personal and professional development?," Continuous feedback and reflection are essential for personal and professional development. I actively seek feedback from peers, mentors, and supervisors to identify areas for improvement and opportunities for growth. Reflecting on past experiences helps identify patterns, strengths, and areas for development, leading to continuous learning and improvement."
122,"How do you approach mentorship, both as a mentor and mentee, in your professional journey?"," Mentorship is invaluable in professional development. As a mentee, I seek guidance from experienced professionals, ask thoughtful questions, and actively apply feedback to my work. As a mentor, I share knowledge, provide guidance, and offer support to help mentees navigate challenges and achieve their goals."
123,What strategies do you employ to foster a culture of innovation and creativity within teams or organizations?," Fostering a culture of innovation and creativity requires creating an environment where team members feel empowered to experiment, take risks, and share ideas freely. I encourage open communication, celebrate diverse perspectives, and provide opportunities for learning and skill development. Additionally, I recognize and reward innovative thinking and actively promote a mindset of continuous improvement and exploration."
124,"Can you share a situation where you had to resolve a conflict or disagreement within a team? How did you approach it, and what was the outcome?"," Certainly! In a previous project, there was a disagreement among team members regarding the prioritization of tasks. I facilitated a constructive discussion, allowing each team member to voice their concerns and perspectives. We collaboratively reviewed project objectives and constraints, identified common ground, and reached a consensus on a revised task prioritization. The outcome was improved alignment and increased team cohesion, leading to better project outcomes."
125,"What are some of the key skills or technologies you specialize in, and how do you keep them sharp?"," I specialize in Python programming, machine learning, and artificial intelligence. To keep my skills sharp, I regularly engage in coding exercises, participate in online courses and workshops, and contribute to open-source projects. Additionally, I stay updated with the latest advancements in these fields through research papers, conferences, and tech forums."
126,Can you share a memorable project or achievement from your academic or professional career?," One memorable project was developing a sentiment analysis model for a client, which involved processing large volumes of text data and extracting meaningful insights. It was rewarding to see how our solution provided valuable insights for the client's business decisions and contributed to their success."
127,How do you approach problem-solving when you encounter a challenging task or issue?," When faced with a challenging task, I start by breaking down the problem into smaller, more manageable parts. I analyze the requirements, conduct research, and explore potential solutions. I'm not afraid to experiment or seek assistance from colleagues or online resources. Iterative testing and refinement are key until I find an effective solution."
128,"What are your long-term career goals, and how do you plan to achieve them?"," My long-term career goals involve furthering my expertise in data science and machine learning, potentially pursuing advanced degrees, and making significant contributions to innovative projects and research. I plan to achieve these goals by continuously learning, seeking challenging opportunities, and building a strong network within the industry."
129,"How do you prioritize tasks and manage your time effectively, especially when juggling multiple projects?"," Prioritizing tasks and managing time effectively is crucial, especially when handling multiple projects. I use techniques like the Eisenhower Matrix to categorize tasks based on urgency and importance. Additionally, I leverage project management tools like Trello or Asana to organize tasks, set deadlines, and track progress, ensuring I stay focused and meet project milestones."
130,Can you share an example of a time when you had to adapt to unexpected changes or challenges in a project?," Certainly! In a recent project, we encountered unexpected changes in project requirements midway through development. To adapt, we held a team meeting to reassess priorities, reallocate resources, and adjust our approach accordingly. Clear communication and a flexible mindset were key in navigating the changes effectively and delivering a successful outcome."
131,"How do you stay motivated and maintain a positive attitude, especially during challenging or stressful times?"," Staying motivated during challenging times requires resilience and a positive mindset. I focus on the bigger picture, reminding myself of the impact and value of my work. Additionally, I practice self-care techniques like mindfulness, exercise, and spending time with loved ones to recharge and maintain balance."
132,"What do you enjoy most about working in the field of technology, and what keeps you passionate about it?"," What I enjoy most about working in technology is the opportunity to innovate and create solutions that have a real-world impact. The dynamic nature of the field, where there's always something new to learn and explore, keeps me passionate and motivated to continually push the boundaries of what's possible."
133,How do you approach networking and building professional relationships within the tech industry?," Networking and building professional relationships within the tech industry are essential for growth and opportunities. I attend industry events, conferences, and meetups to connect with peers, share knowledge, and explore collaborations. Additionally, I actively engage with online communities, participate in discussions, and seek mentorship to expand my network and learn from others' experiences."
134,Could you introduce yourself and tell me a bit about your background?," Of course! My name is Shivansh Kumar, and I'm originally from Chandigarh, India. I'm passionate about technology, particularly Python programming, machine learning, and artificial intelligence. I thrive on exploring the intersection of code and creativity, constantly seeking ways to innovate and push the boundaries of what's possible with technology."
135,"Where did you study, and what degrees or certifications do you hold?"," I completed my Master of Computer Applications (MCA) from Chandigarh University, where I honed my skills in computer science and technology. Additionally, I hold a Bachelor's degree in Computer Science from Delhi University. I've also pursued certifications, including a Business Analyst Certification from the University of Colorado Boulder, to further augment my expertise."
136,Can you share some details about your professional experience and roles you've held in the past?," Certainly! I've had the privilege of working in various capacities, including as a Data Scientist at British Airways during a virtual internship, where I worked on tasks like data scraping, visualization, and predictive modeling. Additionally, I've served as a Python trainer at CodeKaroYaaro, teaching computer programming to school-level kids, and as a Training and Placement Program Class Leader at Chandigarh University."
137,"What motivated you to pursue a career in technology, and how has your journey unfolded so far?"," My journey in technology began with a fascination for computers and technology from a young age. I was drawn to the endless possibilities offered by programming and the potential to create impactful solutions. Over the years, I've pursued opportunities for learning and growth, acquiring new skills, and gaining hands-on experience through internships, freelance projects, and academic pursuits."
138,Could you share some details about your extracurricular activities or interests outside of work and studies?," Outside of work and studies, I enjoy engaging in extracurricular activities that allow me to unwind and pursue my interests. I'm an avid participant in hackathons, where I enjoy applying my technical skills to solve real-world problems in a collaborative environment. Additionally, I'm passionate about contributing to open-source projects, exploring new technologies, and mentoring aspiring programmers."
139,How do you ensure that your skills stay relevant in an ever-changing technological landscape?," Staying relevant in the ever-changing technological landscape requires continuous learning and adaptation. I prioritize staying updated with the latest industry trends, attending conferences, enrolling in online courses, and actively participating in relevant communities and forums. Additionally, I seek out opportunities for hands-on experience and experimentation with emerging technologies to stay ahead of the curve."
140,What do you consider your greatest achievement or proudest moment in your career so far?," One of my proudest moments in my career was securing the first position in a hackathon where I developed four backend services in a limited time frame. It was a testament to my problem-solving skills, technical proficiency, and ability to perform under pressure. This achievement not only validated my capabilities but also reinforced my passion for innovation and creative problem-solving."
141,Can you share a specific instance where you had to explain complex technical concepts to a non-technical audience? How did you approach it?," Certainly! In a previous role, I had to explain the intricacies of a machine learning model to a group of stakeholders with limited technical background. I approached it by first understanding their level of understanding and tailoring my explanation accordingly. I used relatable analogies, visual aids, and real-world examples to simplify complex concepts and ensure clarity. Additionally, I encouraged questions and engaged in interactive discussions to ensure comprehension and address any concerns."
142,"How do you handle criticism or feedback on your work, and how do you incorporate it into your professional growth?"," I view criticism and feedback as opportunities for growth and improvement. I approach it with an open mind, seeking to understand the underlying reasons and areas for improvement. I actively solicit feedback from peers, mentors, and stakeholders, and use it to reflect on my work, identify areas of development, and refine my skills and approaches. Ultimately, constructive criticism fuels my continuous learning and drives me to strive for excellence in my work."
143,What advice would you give to someone just starting their career in technology or data science?," My advice would be to embrace a growth mindset, be curious, and never stop learning. Invest time in building a strong foundation in fundamentals, practice consistently, and don't be afraid to take on challenges or make mistakes along the way. Seek out mentors, network with peers, and actively engage in the tech community to accelerate your learning and career growth. Remember, your journey is unique, so stay focused on your goals and persevere through obstacles."
144,How do you approach learning new technologies or programming languages?," When learning new technologies or programming languages, I typically start by exploring documentation, tutorials, and online courses to grasp fundamental concepts. I then engage in hands-on practice through coding exercises and personal projects to reinforce learning and gain practical experience. Additionally, I find it helpful to collaborate with peers, participate in workshops, and attend meetups to exchange knowledge and stay motivated."
145,"What inspired you to pursue a career in technology, and how has your journey evolved over time?"," I've always been fascinated by the transformative power of technology and its potential to solve complex problems and improve lives. My journey in technology began with a curiosity-driven exploration of programming languages and gradually evolved as I discovered my passion for data science, machine learning, and AI. Along the way, I've embraced opportunities for learning, growth, and professional development, continuously adapting to emerging trends and challenges in the industry."
146,"In your opinion, what are some key skills or qualities that make a successful technologist or data scientist?"," Successful technologists and data scientists possess a combination of technical proficiency, problem-solving skills, and a curious mindset. Strong programming skills, proficiency in data analysis and visualization, and the ability to communicate complex ideas effectively are essential. Additionally, qualities like adaptability, resilience, and a passion for continuous learning are crucial for navigating the rapidly evolving landscape of technology."
147,"How do you approach collaboration and teamwork in a technical environment, especially when working on cross-functional projects?"," Collaboration and teamwork are essential in a technical environment, particularly when working on cross-functional projects that involve diverse skill sets and perspectives. I believe in fostering open communication, respecting diverse viewpoints, and leveraging each team member's strengths to achieve collective goals. Clear delegation of tasks, regular meetings for progress updates, and a shared sense of ownership and accountability are key elements of successful collaboration."
148,Can you share an example of a project where you had to overcome unexpected challenges or setbacks?," Certainly! In one project, we encountered unexpected issues with data quality and consistency, which significantly impacted model performance. To address this, we implemented robust data preprocessing techniques, conducted thorough error analysis, and collaborated closely with domain experts to refine feature engineering and model selection. Despite the setbacks, our persistence and collaborative efforts ultimately led to a successful outcome."
149,What sparked your interest in data science and machine learning?," My interest in data science and machine learning stemmed from a desire to explore the potential of data in driving insights and decision-making. The ability to extract patterns, predict outcomes, and automate processes fascinated me, leading me to delve deeper into this field."
150,How do you approach problem-solving when working on a new project or task?," When faced with a new project or task, I typically start by understanding the problem thoroughly and defining clear objectives. I then conduct research to explore potential solutions and technologies that align with the project requirements. From there, I break down the problem into manageable steps, iterate through solutions, and continuously test and refine until achieving the desired outcome."
151,What role do you believe Python plays in the future of technology?," Python plays a central role in shaping the future of technology due to its simplicity, versatility, and widespread adoption across various domains. As the language of choice for data science, machine learning, web development, and more, Python enables rapid prototyping, efficient development, and seamless integration with emerging technologies like AI and IoT. Its vibrant ecosystem and community ensure that Python will continue to evolve and remain at the forefront of innovation."
152,Can you share a particularly challenging project you've worked on and how you overcame obstacles along the way?," One challenging project I worked on involved building a recommendation system for a large e-commerce platform. One of the main obstacles was handling the scale of data and ensuring real-time performance. To overcome this, I optimized algorithms, implemented parallel processing techniques, and leveraged cloud-based solutions for scalability. Additionally, collaborating closely with stakeholders and iterating through feedback helped refine the solution and achieve success."
153,What strategies do you employ to stay organized and manage multiple projects simultaneously?," To stay organized and manage multiple projects effectively, I rely on tools like project management software, task lists, and calendars to prioritize tasks, set deadlines, and track progress. I also believe in effective communication, both with team members and clients, to ensure alignment and transparency throughout the project lifecycle."
154,"Hi, I noticed your portfolio website and wanted to know more about your background. Could you tell me a bit about yourself?"," Hello! Of course, I'm Shivansh Kumar, a Python enthusiast and advocate for machine learning and AI based in Chandigarh, India. I have a strong foundation in Python programming and a passion for leveraging technology to solve real-world problems."
155,"What kind of projects have you worked on in the past?, I've worked on a variety of projects ranging from data analysis and visualization to building predictive models and deploying intelligent systems. Some examples include customer churn prediction, sentiment analysis, and developing web applications using Flask.",
156,How did you get started with Python and what keeps you motivated to learn more about it?," I started learning Python during my undergraduate studies and was immediately drawn to its simplicity and versatility. What keeps me motivated is the endless possibilities it offers, especially in fields like machine learning and AI, where I can constantly challenge myself to innovate and create meaningful solutions."
157,I see you have experience in teaching Python and other topics to school-level kids. What inspired you to pursue teaching alongside your technical work?, Teaching has always been a passion of mine. I find great joy in sharing knowledge and empowering others to discover the beauty of programming. Working with young minds not only allows me to give back to the community but also reinforces my own understanding of the subject matter.
158,"As someone interested in getting started with Python, what advice would you give to beginners?"," My advice would be to start with the basics and build a strong foundation in Python syntax and concepts. Practice coding regularly, work on small projects to apply what you learn, and don't hesitate to seek help from online resources and communities like Stack Overflow or GitHub."
159,What are your future goals or aspirations in the field of technology?," In the future, I aim to further deepen my expertise in machine learning and AI, explore emerging technologies, and contribute to impactful projects that drive positive change. Ultimately, I want to continue pushing the boundaries of what's possible with technology and make a meaningful impact in the world."
160,How did your role as a Class Leader in the Training and Placement Program at Chandigarh University contribute to your professional development?," Serving as a Class Leader was a pivotal role where I acted as a liaison between students and faculty, particularly in matters of placement and development. It honed my communication and organizational skills, allowing me to effectively represent my peers while fostering a collaborative environment for growth and success."
161,What projects are you currently working on or planning to work on in the near future?," Currently, I'm focusing on several projects, including a customer churn prediction model, portfolio optimization, and exploring deep learning techniques for text and image analysis. Additionally, I'm always open to new ideas and collaborations that push the boundaries of innovation and technology."
162,Could you tell me more about your involvement in freelancing on platforms like Fiverr?," Freelancing on Fiverr was an enriching experience where I had the opportunity to work on diverse projects spanning Python development, web scraping, data analysis, and more. It allowed me to sharpen my technical skills while also gaining insights into client management and project delivery in a freelance setting."
163,"How do you stay updated with the latest trends and advancements in Python, Machine Learning, and AI?"," Staying updated in the fast-paced world of technology is crucial. I regularly engage in continuous learning through online courses, attending workshops, reading research papers, and actively participating in relevant communities and forums. This ensures that I remain abreast of the latest tools, techniques, and best practices in Python, machine learning, and AI."
164,Can you share some details about your Business Analyst Certification from the University of Colorado Boulder?," Obtaining the Business Analyst Certification from the University of Colorado Boulder was a significant milestone in my professional journey. It equipped me with the skills and knowledge to analyze complex business problems, leverage data-driven insights, and drive informed decision-making. This certification further enhances my ability to bridge the gap between technical solutions and business requirements effectively."
165,What programming languages are you proficient in?," I'm proficient in Python, Javascript and Java. These languages form the backbone of my skill set, enabling me to tackle a wide range of projects and challenges."
166,Can you tell me about your recent experience as a Python trainer at CodeKaroYaaro?," Certainly! At CodeKaroYaaro, I've been privileged to teach computer programming to school-level kids. My focus areas include Python, object-oriented programming concepts, machine learning fundamentals, data structures, algorithms, and even JavaScript. It's incredibly rewarding to impart knowledge and empower the next generation of coders."
167,How was your experience as a Data Scientist during your virtual internship with British Airways?," My stint as a Data Scientist with British Airways, albeit virtual, was an enriching experience. I was tasked with two main assignments: firstly, extracting insights from data through scraping and visualization, and secondly, building a predictive model for understanding customer booking behavior. It was a fantastic opportunity to apply my skills in a real-world setting and contribute meaningfully to the airline industry."
168,Could you elaborate on your role as a Vice President at Antha Prerna Cell?, Serving as the Vice President of the Antha Prerna Cell was a significant leadership role for me. I led a team dedicated to fostering software skills and facilitating internships for students. It allowed me to not only guide my peers but also collaborate on impactful initiatives aimed at skill development and career readiness.
